{"rev":"80557561ddf0f4cd","lenses":["business","design","development","operations","security","quality","performance","com.kettle.cost"],"wings":[{"id":"0:FND","name":"Foundations","order":0,"box":{"x":0,"y":0,"w":532,"h":1622},"letter":"A"},{"id":"0:OPS","name":"Studio operations","order":1,"box":{"x":692,"y":0,"w":1042,"h":1678},"letter":"B"},{"id":"0:MNY","name":"Money","order":2,"box":{"x":1894,"y":0,"w":532,"h":700},"letter":"C"},{"id":"0:MBR","name":"Members & reach","order":3,"box":{"x":2586,"y":0,"w":532,"h":1492},"letter":"D"},{"id":"0:FRN","name":"Frontier","order":4,"box":{"x":3278,"y":0,"w":532,"h":1492},"letter":"E"}],"rooms":[{"id":"platform","parentId":"0:FND","name":"Platform & Operations","order":0,"box":{"x":0,"y":0,"w":532,"h":1054}},{"id":"identity","parentId":"0:FND","name":"Identity & Access","order":1,"box":{"x":0,"y":1094,"w":532,"h":528}},{"id":"scheduling","parentId":"0:OPS","name":"Scheduling & Classes","order":0,"box":{"x":692,"y":0,"w":1042,"h":490}},{"id":"booking","parentId":"0:OPS","name":"Booking & Attendance","order":1,"box":{"x":692,"y":530,"w":1042,"h":356}},{"id":"studio-setup","parentId":"0:OPS","name":"Studio Setup","order":2,"box":{"x":692,"y":926,"w":1042,"h":356}},{"id":"instructor-tools","parentId":"0:OPS","name":"Instructor Tools","order":3,"box":{"x":692,"y":1322,"w":1042,"h":356}},{"id":"payments","parentId":"0:MNY","name":"Memberships & Payments","order":0,"box":{"x":1894,"y":0,"w":532,"h":700}},{"id":"member-experience","parentId":"0:MBR","name":"Member Experience","order":0,"box":{"x":2586,"y":0,"w":532,"h":528}},{"id":"communications","parentId":"0:MBR","name":"Communications","order":1,"box":{"x":2586,"y":568,"w":532,"h":442}},{"id":"growth","parentId":"0:MBR","name":"Growth & Marketing","order":2,"box":{"x":2586,"y":1050,"w":532,"h":442}},{"id":"analytics","parentId":"0:FRN","name":"Analytics & Reporting","order":0,"box":{"x":3278,"y":0,"w":532,"h":528}},{"id":"integrations","parentId":"0:FRN","name":"Integrations & API","order":1,"box":{"x":3278,"y":568,"w":532,"h":442}},{"id":"assistant","parentId":"0:FRN","name":"Kettle Assistant","order":2,"box":{"x":3278,"y":1050,"w":532,"h":442}}],"bays":[{"id":"platform.infrastructure","parentId":"platform","name":"Infrastructure","order":0,"box":{"x":16,"y":72,"w":500,"h":306}},{"id":"platform.observability","parentId":"platform","name":"Observability","order":1,"box":{"x":16,"y":378,"w":500,"h":220}},{"id":"platform.compliance","parentId":"platform","name":"Compliance","order":2,"box":{"x":16,"y":598,"w":500,"h":220}},{"id":"platform.delivery","parentId":"platform","name":"Delivery","order":3,"box":{"x":16,"y":818,"w":500,"h":220}},{"id":"identity.sign-in","parentId":"identity","name":"Sign-in","order":0,"box":{"x":16,"y":1166,"w":500,"h":220}},{"id":"identity.roles-permissions","parentId":"identity","name":"Roles & permissions","order":1,"box":{"x":16,"y":1386,"w":500,"h":220}},{"id":"scheduling.timetable","parentId":"scheduling","name":"Timetable","order":0,"box":{"x":708,"y":72,"w":1010,"h":134}},{"id":"scheduling.appointments","parentId":"scheduling","name":"Appointments","order":1,"box":{"x":708,"y":206,"w":1010,"h":134}},{"id":"scheduling.events-courses","parentId":"scheduling","name":"Events & courses","order":2,"box":{"x":708,"y":340,"w":1010,"h":134}},{"id":"booking.booking","parentId":"booking","name":"Booking","order":0,"box":{"x":708,"y":602,"w":1010,"h":134}},{"id":"booking.check-in","parentId":"booking","name":"Check-in","order":1,"box":{"x":708,"y":736,"w":1010,"h":134}},{"id":"studio-setup.onboarding","parentId":"studio-setup","name":"Onboarding","order":0,"box":{"x":708,"y":998,"w":1010,"h":134}},{"id":"studio-setup.locations-rooms","parentId":"studio-setup","name":"Locations & rooms","order":1,"box":{"x":708,"y":1132,"w":1010,"h":134}},{"id":"instructor-tools.teaching","parentId":"instructor-tools","name":"Teaching","order":0,"box":{"x":708,"y":1394,"w":1010,"h":134}},{"id":"instructor-tools.pay-performance","parentId":"instructor-tools","name":"Pay & performance","order":1,"box":{"x":708,"y":1528,"w":1010,"h":134}},{"id":"payments.plans-products","parentId":"payments","name":"Plans & products","order":0,"box":{"x":1910,"y":72,"w":500,"h":220}},{"id":"payments.billing","parentId":"payments","name":"Billing","order":1,"box":{"x":1910,"y":292,"w":500,"h":392}},{"id":"member-experience.member-app","parentId":"member-experience","name":"Member app","order":0,"box":{"x":2602,"y":72,"w":500,"h":306}},{"id":"member-experience.public-booking-page","parentId":"member-experience","name":"Public booking page","order":1,"box":{"x":2602,"y":378,"w":500,"h":134}},{"id":"communications.messaging","parentId":"communications","name":"Messaging","order":0,"box":{"x":2602,"y":640,"w":500,"h":220}},{"id":"communications.campaigns","parentId":"communications","name":"Campaigns","order":1,"box":{"x":2602,"y":860,"w":500,"h":134}},{"id":"growth.acquisition","parentId":"growth","name":"Acquisition","order":0,"box":{"x":2602,"y":1122,"w":500,"h":220}},{"id":"growth.retention","parentId":"growth","name":"Retention","order":1,"box":{"x":2602,"y":1342,"w":500,"h":134}},{"id":"analytics.dashboards","parentId":"analytics","name":"Dashboards","order":0,"box":{"x":3294,"y":72,"w":500,"h":220}},{"id":"analytics.insight","parentId":"analytics","name":"Insight","order":1,"box":{"x":3294,"y":292,"w":500,"h":220}},{"id":"integrations.developer-platform","parentId":"integrations","name":"Developer platform","order":0,"box":{"x":3294,"y":640,"w":500,"h":134}},{"id":"integrations.connected-systems","parentId":"integrations","name":"Connected systems","order":1,"box":{"x":3294,"y":774,"w":500,"h":220}},{"id":"assistant.for-studios","parentId":"assistant","name":"For studios","order":0,"box":{"x":3294,"y":1122,"w":500,"h":220}},{"id":"assistant.for-members","parentId":"assistant","name":"For members","order":1,"box":{"x":3294,"y":1342,"w":500,"h":134}}],"tiles":[{"id":"file-storage-cdn","parentId":"platform.infrastructure","name":"File storage & CDN","order":0,"box":{"x":16,"y":118,"w":160,"h":76},"health":{"business":"good","design":"na","development":"good","operations":"good","security":"good","quality":"good","performance":"unmeasured","com.kettle.cost":"good"},"general":"good"},{"id":"background-job-queue","parentId":"platform.infrastructure","name":"Background job queue","order":1,"box":{"x":186,"y":118,"w":160,"h":76},"health":{"business":"good","design":"na","development":"good","operations":"good","security":"good","quality":"good","performance":"unmeasured","com.kettle.cost":"good"},"general":"good"},{"id":"feature-flag-service","parentId":"platform.infrastructure","name":"Feature flag service","order":2,"box":{"x":356,"y":118,"w":160,"h":76},"health":{"business":"good","design":"na","development":"good","operations":"good","security":"good","quality":"good","performance":"unmeasured","com.kettle.cost":"good"},"general":"good"},{"id":"database-backups-point-in-time-restore","parentId":"platform.infrastructure","name":"Database backups & point-in-time restore","order":3,"box":{"x":16,"y":204,"w":160,"h":76},"health":{"business":"good","design":"na","development":"good","operations":"good","security":"good","quality":"good","performance":"unmeasured","com.kettle.cost":"good"},"general":"good"},{"id":"multi-tenant-data-isolation","parentId":"platform.infrastructure","name":"Multi-tenant data isolation","order":4,"box":{"x":186,"y":204,"w":160,"h":76},"health":{"business":"good","design":"na","development":"good","operations":"good","security":"good","quality":"watch","performance":"unmeasured","com.kettle.cost":"good"},"general":"watch"},{"id":"rate-limiting-abuse-protection","parentId":"platform.infrastructure","name":"Rate limiting & abuse protection","order":5,"box":{"x":356,"y":204,"w":160,"h":76},"health":{"business":"good","design":"na","development":"good","operations":"na","security":"good","quality":"good","performance":"unmeasured","com.kettle.cost":"unmeasured"},"general":"good"},{"id":"disaster-recovery-plan","parentId":"platform.infrastructure","name":"Disaster recovery plan","order":6,"box":{"x":16,"y":290,"w":160,"h":76},"health":{"business":"good","design":"na","development":"na","operations":"na","security":"na","quality":"na","performance":"unmeasured","com.kettle.cost":"unmeasured"},"general":"good"},{"id":"on-call-alerting","parentId":"platform.observability","name":"On-call alerting","order":0,"box":{"x":16,"y":424,"w":160,"h":76},"health":{"business":"good","design":"na","development":"good","operations":"good","security":"good","quality":"good","performance":"unmeasured","com.kettle.cost":"good"},"general":"good"},{"id":"structured-logging","parentId":"platform.observability","name":"Structured logging","order":1,"box":{"x":186,"y":424,"w":160,"h":76},"health":{"business":"good","design":"na","development":"good","operations":"good","security":"good","quality":"good","performance":"unmeasured","com.kettle.cost":"good"},"general":"good"},{"id":"uptime-slo-dashboards","parentId":"platform.observability","name":"Uptime & SLO dashboards","order":2,"box":{"x":356,"y":424,"w":160,"h":76},"health":{"business":"good","design":"na","development":"good","operations":"good","security":"good","quality":"good","performance":"unmeasured","com.kettle.cost":"good"},"general":"good"},{"id":"distributed-tracing","parentId":"platform.observability","name":"Distributed tracing","order":3,"box":{"x":16,"y":510,"w":160,"h":76},"health":{"business":"good","design":"na","development":"good","operations":"na","security":"watch","quality":"na","performance":"unmeasured","com.kettle.cost":"unmeasured"},"general":"watch"},{"id":"cloud-cost-monitoring","parentId":"platform.observability","name":"Cloud cost monitoring","order":4,"box":{"x":186,"y":510,"w":160,"h":76},"health":{"business":"good","design":"na","development":"good","operations":"na","security":"watch","quality":"na","performance":"unmeasured","com.kettle.cost":"unmeasured"},"